Rank	GO.ID	Term	Pvalue	nAnnotated	nSignificant	Annotated	Significant
12	GO:0030544	Hsp70 protein binding	0.00467	34	3	BAG6, BAX, CDK1, CDKN1B, CREB1, DNAJA1, DNAJA3, DNAJB1, DNAJB12, DNAJB14, DNAJB2, DNAJB9, DNAJC10, DNAJC18, DNAJC2, DNAJC8, ERN1, FICD, HDAC8, IQCG, METTL21A, MVD, NOD2, NUP62, PPID, RNF207, RPS3, SACS, SNCA, SPN, ST13, STIP1, STUB1, TSC1	DNAJB1, RPS3, ST13
13	GO:0019901	protein kinase binding	0.0064	507	13	AATF, ABL1, ACE, ACSL3, ACTA2, ACTB, ACVR1, ADAM10, ADAM9, ADCY4, ADD2, ADIPOR1, AGAP2, AKAP7, AKT1, ANGPT2, ANKRA2, AP1B1, AP2A1, AP2A2, APC, APPL1, ARHGAP33, ARHGEF7, ARRB1, ARRB2, ATF2, ATF4, ATF7, ATG13, ATP1A1, ATP1B1, ATP2B4, AURKA, AXIN1, BAD, BAG5, BANK1, BCL10, BCL11A, BCL2L1, BCL2L11, BCL2L14, BECN1, BICD1, BLNK, BMPR2, BORA, BRSK1, C1QBP, CACUL1, CALM1, CALM2, CALM3, CAMK2N1, CASP9, CASS4, CAV1, CBL, CBLB, CCDC88A, CCNA2, CCNB1, CCND1, CCND2, CCND3, CCNE1, CCNE2, CCNK, CCNT1, CCNY, CCNYL1, CD2, CD226, CD247, CD28, CD3E, CD4, CDC25A, CDC25B, CDC37, CDC42, CDC5L, CDK12, CDK13, CDK5, CDK5R1, CDK5RAP1, CDK5RAP2, CDK5RAP3, CDK9, CDKN1A, CDKN1B, CDKN2A, CDKN2B, CDKN2C, CDKN2D, CEACAM1, CENPJ, CEP152, CEP250, CEP68, CHEK2, CIB1, CIR1, CKS1B, CKS2, CLTC, CNKSR2, CNPPD1, CNTLN, CPNE3, CRK, CRY1, CSK, CTBP2, CTNNB1, CTNND1, CYLD, DACT1, DAXX, DAZAP2, DBF4B, DCTN1, DCTN2, DLG1, DNAJC3, DNM2, DOCK4, DOK2, DOK7, DUSP1, DUSP10, DUSP16, DUSP19, DUSP2, DUSP22, DUSP3, DUSP4, DUSP5, DUSP6, DUSP7, DUSP8, DVL1, DVL2, E2F1, EEF1A1, EEF2, EIF3A, ELAVL1, ELMO2, ELP2, EPHA1, EPHA4, ERCC6L2, EXOC2, EZR, FAF1, FAM83G, FBXO5, FBXO7, FBXW5, FCRL3, FEZ1, FGR, FIZ1, FLT3LG, FNTA, FOXM1, FOXO3, FRS2, GAB2, GAS6, GCH1, GCSAM, GLRX3, GOLGA2, GRB2, GRK5, GSK3A, GSK3B, GSKIP, GSTP1, GYS1, HCLS1, HDAC4, HDAC5, HDAC7, HDAC9, HIF1A, HINT1, HNRNPA0, HSF1, HSP90AA1, HSP90AB1, HSPB1, HYAL2, IBTK, IFNAR2, IKBKB, IL12RB2, IL15RA, ILK, IQGAP1, IRGM, IRS1, IRS2, ITGAV, ITGAX, ITGB1, ITGB1BP1, ITGB2, JAK2, JTB, JUP, KAT2B, KCNQ1, KHDRBS1, KIF11, KIF13B, KIF5B, KSR1, LAT, LATS1, LAX1, LCK, LIME1, LIMS1, LIPE, LLGL1, LRBA, LYST, MAD2L2, MAML1, MAP2K3, MAP2K4, MAP2K6, MAP2K7, MAP3K1, MAP3K11, MAP3K12, MAP3K13, MAP3K2, MAP3K5, MAP3K7, MAP4K2, MAPK1, MAPK14, MAPK6, MAPK7, MAPK8IP3, MAPKAP1, MAPKAPK2, MAPKAPK3, MAPKAPK5, MAPRE1, MAPRE2, MAPRE3, MARCKS, MAVS, MEF2A, MICAL1, MLKL, MSH2, MSN, MST1, MTCP1, MTOR, MVP, NBEAL1, NBEAL2, NBR1, NCK1, NEDD9, NEFH, NEK6, NEK9, NELL2, NFATC1, NISCH, NOD2, NPM1, NR3C1, NR4A3, NRG1, NSF, OXSR1, PAK1, PAK2, PAM, PARD6A, PARD6B, PARN, PARP1, PCNA, PDCD10, PDE3B, PDGFRB, PDLIM5, PDPK1, PEBP1, PFKFB2, PGAM1, PICK1, PIFO, PIH1D1, PIK3R1, PIK3R2, PIN1, PINK1, PITPNM1, PITPNM2, PIWIL1, PJA2, PKD1, PKIA, PKN1, PLA2G6, PLCG1, PLEK, PLK1, POLA1, PPM1D, PPME1, PPP1CB, PPP1CC, PPP1R12A, PPP1R12B, PPP1R12C, PPP1R15A, PRAM1, PRC1, PRDX3, PRKAB1, PRKAB2, PRKACA, PRKAG1, PRKAG2, PRKAR1A, PRKAR1B, PRKAR2A, PRKAR2B, PRKCB, PRKCD, PRKCSH, PRKCZ, PRKD2, PRKRIP1, PRMT1, PRR7, PSPN, PTAFR, PTEN, PTK2, PTK2B, PTPN1, PTPN11, PTPN2, PTPN23, PTPN6, PTPRC, PTPRJ, PTPRK, PXN, RAB11FIP2, RAB8A, RAC1, RAC2, RAC3, RACGAP1, RAD9A, RAF1, RARA, RB1CC1, RBBP6, RCC2, RELA, RELB, RFFL, RGCC, RGS14, RHEB, RHOA, RHOB, RHOBTB1, RHOBTB2, RHOBTB3, RHOC, RHOD, RHOF, RHOG, RHOH, RICTOR, RND1, RNF13, RNF138, RNF41, RPS19, RPS3, RPS6, RPS6KA3, RPS7, RPTOR, SH2B1, SH2B2, SH2B3, SHC1, SIK1, SIKE1, SIRPA, SIRT1, SKAP1, SKI, SLC12A2, SLC12A4, SLC12A7, SMAD1, SMAD3, SMCR8, SOCS1, SOCS5, SPAG9, SPDYA, SPRED1, SQSTM1, SRC, SREBF1, SRSF2, SRSF5, STAP1, STAT3, STK11IP, STK38, STK39, STRIP1, STX17, STXBP1, SUFU, SV2A, SYK, TAB1, TAOK2, TBC1D14, TBL2, TCF3, TCF7L2, TCL1A, TCL1B, TDG, TELO2, TESK1, TEX14, TFRC, TGFBR2, TIAM1, TICAM1, TIRAP, TJP2, TNIP1, TNIP2, TOB1, TOM1L2, TOP2A, TOP2B, TP53, TPCN2, TPR, TPRKB, TPX2, TRADD, TRAF2, TRAF3, TRAF4, TRAF6, TRAP1, TRAT1, TRIB1, TRIB2, TRIB3, TRIM14, TRIM21, TRIM22, TRIM27, TRIM34, TRIM38, TRIM5, TRIM68, TRIP4, TSKS, TTN, TUBA4A, TWF2, UFL1, USF1, USP37, UTRN, VDAC1, VRK1, VRK2, WAS, WDR45, WNK1, YWHAG, YWHAZ, ZBTB4, ZC3HC1, ZFP36	CD3E, EEF1A1, FLT3LG, HINT1, LAT, LCK, NPM1, PEBP1, RGCC, RHOH, RPS3, RPS6, TRAT1
14	GO:0055106	ubiquitin-protein transferase regulator activity	0.01226	17	2	AUP1, BTRC, CBX8, CDC20, FBXO5, FBXW7, FZR1, GLMN, RING1, RPL11, RPL23, RPL5, RPS7, TRIB1, TRIB2, TRIB3, UBE2L3	RPL11, RPL5
15	GO:0043027	cysteine-type endopeptidase inhibitor activity involved in apoptotic process	0.01679	20	2	ARRB1, BIRC2, BIRC3, BIRC5, CD27, GAS6, LEF1, MT3, NAIP, NOL3, PRDX3, PRDX5, RPS6KA1, RPS6KA3, SERPINB9, SNCA, TNFAIP8, TNFSF14, VIL1, XIAP	CD27, LEF1
16	GO:0043548	phosphatidylinositol 3-kinase binding	0.01844	21	2	ATP1A1, AXL, BECN1, CALM3, CBL, CORO1A, DAB1, DNM2, FYN, HCST, IGF1R, INSR, IRS1, IRS2, JAK2, LCK, PDGFRB, PIK3AP1, PIK3IP1, PIK3R1, PTPN13	LCK, PIK3IP1
17	GO:0019210	kinase inhibitor activity	0.01985	54	2	CAMK2N1, CASP3, CDKN1A, CDKN1B, CDKN1C, CDKN2A, CDKN2B, CDKN2C, CDKN2D, CHP1, CIB1, DNAJC3, DUS2, DUSP19, GMFB, GMFG, GSKIP, HEXIM1, HEXIM2, HSPB1, HYAL2, IBTK, IMPACT, ITPRIP, KAT2B, LRP6, MBIP, NCK1, NPM1, PKIA, PKIB, PKIG, PRKAG2, PRKAR1A, PRKAR1B, PRKAR2A, PRKAR2B, PRKRIP1, RHOH, RPTOR, SH3BP5, SH3BP5L, SMCR8, SNCA, SOCS1, SOCS3, SPRED1, TAOK3, TESC, TRIB1, TRIB2, TRIB3, WNK1, YWHAG	NPM1, RHOH
18	GO:0051059	NF-kappaB binding	0.03828	31	2	AKAP8, ANXA4, APEX1, BCL10, BRMS1, CDK5RAP3, CDKN2A, COMMD6, COMMD7, CPNE1, EP300, FAF1, FOXP3, GSK3B, HDAC1, HDAC2, HDAC3, HIF1AN, MAMSTR, MTDH, NFKBIA, NFKBID, NOTCH2, NPM1, PPARD, PSMA6, RELA, RNF25, SETD6, TAF4B, TP53BP2	COMMD6, NPM1
19	GO:0051087	chaperone binding	0.04899	82	3	AHSA1, AMFR, ATP1A1, ATP1A3, ATP7A, BAG1, BAG2, BAG3, BAG4, BAG5, BAK1, BAX, BIN1, BIRC2, BIRC5, CALR, CDC25A, CDC37, CDC37L1, CDKN1B, CLU, CTSC, DNAJA1, DNAJA2, DNAJA4, DNAJB1, DNAJB2, DNAJB4, DNAJB5, DNAJB6, DNAJB9, DNAJC1, DNAJC10, DNAJC3, DNLZ, ERP29, FICD, FNIP1, FNIP2, GAK, GET4, GNB5, GRN, GRPEL1, GRPEL2, HES1, HLA-B, HSCB, HSPA2, HSPA5, HSPA8, HSPD1, HSPE1, HYOU1, KSR1, PFDN4, PFDN6, PRNP, PTGES3, RNF207, SACS, SCARB2, SDF2L1, SLC12A2, SLC25A17, SOD1, ST13, STIP1, STUB1, SYVN1, TBCA, TBCC, TBCD, TBCE, TIMM10, TIMM44, TIMM9, TP53, TSC1, UBL4A, USP13, WRAP53	DNAJB1, SOD1, ST13
